[
  {
    "schema_version": 1,
    "organization_id": "11111111-1111-4111-8111-111111111111",
    "user_id": "11111111-1111-4111-8111-111111111111",
    "region_id": "11111111-1111-4111-8111-111111111111",
    "provider_connection_id": "11111111-1111-4111-8111-111111111111",
    "installation_id": "11111111-1111-4111-8111-111111111111",
    "host_id": "11111111-1111-4111-8111-111111111111",
    "conversation_id": "11111111-1111-4111-8111-111111111111",
    "provider": "openai",
    "model": "fixture-model",
    "agent_kind": "codex",
    "agent_version": "0.163.0-alpha.10.2",
    "context_format_version": 1
  }
]
